{
  "schemaVersion": "1.1.0",
  "id": "00000000-0000-4000-8000-000000000009",
  "workspaceId": "00000000-0000-4000-8000-000000000004",
  "eventType": "package.execution.approved",
  "aggregateType": "package",
  "aggregateId": "00000000-0000-4000-8000-000000000002",
  "occurredAt": "2026-09-24T12:10:00Z",
  "receivedAt": "2026-09-24T12:10:01Z",
  "correlationId": "00000000-0000-4000-8000-000000000010",
  "causationId": null,
  "deduplicationKey": "approval:00000000-0000-4000-8000-000000000007",
  "source": {
    "kind": "platform",
    "id": "approval-service",
    "instanceId": "platform"
  },
  "actor": {
    "kind": "human",
    "id": "00000000-0000-4000-8000-000000000006"
  },
  "payload": {
    "approvalId": "00000000-0000-4000-8000-000000000007",
    "revisionId": "00000000-0000-4000-8000-000000000001",
    "revisionHash": "bbbbbbbbbbbbbbbbbbbbbbbbbbbbbbbbbbbbbbbbbbbbbbbbbbbbbbbbbbbbbbbb"
  }
}
